{
  "schema_version": 1,
  "target": "runtime/skills/code_pinpoint.json",
  "kind": "skill",
  "expected_base_sha256": "58d707bfe8f74845e47748cc5ba4ad5baccc8a40d793462545db37adced2a498",
  "replacement": "code_pinpoint.runtime.json",
  "replacement_sha256": "7dcd3379b4c47cf8ed01a7b3ffbe1a0dc996be472b33e960cfe9b7dbaa0a54e4",
  "reason": "Keep the public projection portable: English anchor wording and no SmartPerfetto ${package} signal patterns. The deterministic native-symbol query itself was upstreamed and is now taken from the base.",
  "regression_ids": [
    "startup-heavy-code-pinpoint-anchor-kind",
    "callstack-code-pinpoint-function"
  ],
  "dependent_replacements": [
    {
      "target": "runtime/android/code_pinpoint.json",
      "expected_base_sha256": "1d1ffc3b093ed1d9a494509aea83fbdde45c5364315211da73c94d32bf6ebb7c",
      "replacement": "code_pinpoint.android.json",
      "replacement_sha256": "19f195be05b69d1d92d955623984a77496c01588435ec409863555f42f9efeb0"
    },
    {
      "target": "runtime/queries/code_pinpoint.json",
      "expected_base_sha256": "a648ae2fdddf2a154d40c6e24d13bc7cef3fe98afd4de7eb4bdf3c45e48cf8dc",
      "replacement": "code_pinpoint.queries.json",
      "replacement_sha256": "97e87d1fb51a992fd4511cc6964af9ca29044931172b543f434dec44d790769a"
    },
    {
      "target": "skills/code_pinpoint.md",
      "expected_base_sha256": "fbb5e6a38ca032d4f97c1070cb1588253a8698d7300e884e9bba58690eaf8f6d",
      "replacement": "code_pinpoint.md",
      "replacement_sha256": "13926b9519cbc87a20c346e030d9fadfaf9ba777fdebf95375884dcef55ce17e"
    }
  ],
  "upstream_candidate": "propose"
}
